[
  {
    "id": "aider",
    "name": "Aider",
    "vendor": "Aider-AI",
    "status": "active",
    "category": "cli-agent",
    "interfaces": ["cli"],
    "platforms": {
      "operating_systems": ["windows", "macos", "linux"],
      "editors": [],
      "deployment": [],
      "integrations": [],
      "notes": []
    },
    "execution": "local-tools",
    "model_policy": "provider-agnostic",
    "byok": true,
    "self_host": true,
    "open_source": true,
    "license": "Apache-2.0",
    "pricing": {
      "model": "free",
      "free_tier": true,
      "starting_price_usd_month": 0,
      "note": "The client is free; model API or local hardware costs are separate."
    },
    "best_for": ["Git-centered terminal workflows", "broad provider choice"],
    "strengths": ["Repository map and automatic Git checkpoints", "hundreds of model paths through LiteLLM", "editor-agnostic"],
    "limitations": ["No full native GUI", "model quality and metadata vary by provider", "no bundled inference"],
    "official_sources": [
      {"label": "Docs", "url": "https://aider.chat/"},
      {"label": "Models", "url": "https://aider.chat/docs/llms.html"},
      {"label": "Repository", "url": "https://github.com/Aider-AI/aider"}
    ],
    "last_verified": "2026-08-04"
  },
  {
    "id": "amp",
    "name": "Amp",
    "vendor": "Sourcegraph",
    "status": "active",
    "category": "cli-agent",
    "interfaces": ["cli", "ide", "web"],
    "platforms": {
      "operating_systems": ["windows", "macos", "linux"],
      "editors": ["vs-code", "neovim", "zed"],
      "deployment": ["wsl"],
      "integrations": [],
      "notes": ["Windows support is via WSL"]
    },
    "execution": "hybrid",
    "model_policy": "curated-multi-model",
    "byok": false,
    "self_host": false,
    "open_source": false,
    "license": null,
    "pricing": {
      "model": "hybrid",
      "free_tier": true,
      "starting_price_usd_month": 20,
      "note": "Free availability may be capacity-limited; PAYG has a minimum credit purchase; Megawatt is $20/month and Gigawatt is $200/month."
    },
    "best_for": ["opinionated frontier-model routing", "collaborative agent threads"],
    "strengths": ["Terminal, editor, web, Slack, and remote-agent surfaces", "specialized subagents and high-reasoning modes"],
    "limitations": ["No general local-model path", "managed routing limits model control", "cloud account required"],
    "official_sources": [
      {"label": "Manual", "url": "https://ampcode.com/manual"},
      {"label": "Pricing", "url": "https://ampcode.com/pricing"},
      {"label": "Modes", "url": "https://ampcode.com/modes"}
    ],
    "last_verified": "2026-08-04"
  },
  {
    "id": "amazon-q-developer",
    "name": "Amazon Q Developer",
    "vendor": "Amazon Web Services",
    "status": "active",
    "category": "ide-extension",
    "interfaces": ["ide", "cli", "web"],
    "platforms": {
      "operating_systems": ["windows", "macos", "linux"],
      "editors": ["vs-code", "jetbrains", "visual-studio", "eclipse"],
      "deployment": [],
      "integrations": [],
      "notes": []
    },
    "execution": "hybrid",
    "model_policy": "vendor-models",
    "byok": false,
    "self_host": false,
    "open_source": false,
    "license": null,
    "pricing": {
      "model": "subscription",
      "free_tier": true,
      "starting_price_usd_month": 19,
      "note": "A free individual tier is available; Pro is priced per user per month. Check the AWS page for current quotas and regional terms."
    },
    "best_for": ["AWS-heavy development", "IDE and command-line assistance"],
    "strengths": ["AWS console and service context", "IDE, CLI, transformation, and security-oriented capabilities"],
    "limitations": ["Strongest fit is the AWS ecosystem", "models and quotas are managed by AWS", "not self-hosted"],
    "official_sources": [
      {"label": "Product", "url": "https://aws.amazon.com/q/developer/"},
      {"label": "Pricing", "url": "https://aws.amazon.com/q/developer/pricing/"},
      {"label": "Docs", "url": "https://docs.aws.amazon.com/amazonq/latest/qdeveloper-ug/what-is.html"},
      {"label": "IDE setup and platform support", "url": "https://docs.aws.amazon.com/amazonq/latest/qdeveloper-ug/q-in-IDE-setup.html"}
    ],
    "last_verified": "2026-08-04"
  },
  {
    "id": "anythingllm",
    "name": "AnythingLLM",
    "vendor": "Mintplex Labs",
    "status": "active",
    "category": "web-gui",
    "interfaces": ["desktop", "web", "api"],
    "platforms": {
      "operating_systems": ["windows", "macos", "linux"],
      "editors": [],
      "deployment": ["containers"],
      "integrations": [],
      "notes": []
    },
    "execution": "local-tools",
    "model_policy": "provider-agnostic",
    "byok": true,
    "self_host": true,
    "open_source": true,
    "license": "MIT",
    "pricing": {
      "model": "free",
      "free_tier": true,
      "starting_price_usd_month": 0,
      "note": "Self-hosted and desktop editions are free; managed or enterprise offerings and model use may add cost."
    },
    "best_for": ["local document chat and agents", "team self-hosting"],
    "strengths": ["Desktop and Docker deployment", "many model and vector database integrations", "workspace-oriented RAG"],
    "limitations": ["Less code-editor-native than dedicated coding agents", "security and model hosting are operator responsibilities"],
    "official_sources": [
      {"label": "Product", "url": "https://anythingllm.com/"},
      {"label": "Docs", "url": "https://docs.anythingllm.com/"},
      {"label": "Repository", "url": "https://github.com/Mintplex-Labs/anything-llm"}
    ],
    "last_verified": "2026-08-04"
  },
  {
    "id": "claude-code",
    "name": "Claude Code",
    "vendor": "Anthropic",
    "status": "active",
    "category": "cli-agent",
    "interfaces": ["cli", "ide", "desktop", "web", "mobile"],
    "platforms": {
      "operating_systems": ["windows", "macos", "linux"],
      "editors": ["vs-code", "jetbrains"],
      "deployment": [],
      "integrations": ["claude-desktop"],
      "notes": []
    },
    "execution": "hybrid",
    "model_policy": "vendor-models",
    "byok": false,
    "self_host": false,
    "open_source": false,
    "license": null,
    "pricing": {
      "model": "hybrid",
      "free_tier": false,
      "starting_price_usd_month": 20,
      "note": "Included with Claude Pro from $20/month and Max from $100/month, or billed through supported API/cloud-provider routes. Usage varies by model and context."
    },
    "best_for": ["deep terminal-first repository work", "Claude-centered workflows"],
    "strengths": ["Mature multi-file agent with commands and MCP", "local, desktop, editor, and managed web sessions", "strong repository reasoning"],
    "limitations": ["Claude-family models only", "network required for inference", "long agent loops can consume substantial usage"],
    "official_sources": [
      {"label": "Overview", "url": "https://docs.anthropic.com/en/docs/claude-code/overview"},
      {"label": "Security", "url": "https://docs.anthropic.com/en/docs/claude-code/security"},
      {"label": "Pricing", "url": "https://claude.com/pricing"}
    ],
    "last_verified": "2026-08-04"
  },
  {
    "id": "cline",
    "name": "Cline",
    "vendor": "Cline",
    "status": "active",
    "category": "ide-extension",
    "interfaces": ["ide", "cli", "ci"],
    "platforms": {
      "operating_systems": ["windows", "macos", "linux"],
      "editors": ["vs-code", "jetbrains"],
      "deployment": [],
      "integrations": [],
      "notes": []
    },
    "execution": "hybrid",
    "model_policy": "provider-agnostic",
    "byok": true,
    "self_host": true,
    "open_source": true,
    "license": "Apache-2.0",
    "pricing": {
      "model": "usage-based",
      "free_tier": true,
      "starting_price_usd_month": null,
      "note": "The open-source client is free for individuals; hosted inference is usage-based at model cost, and BYOK or local inference is supported. Enterprise terms are custom."
    },
    "best_for": ["approval-driven IDE agents", "broad BYOK and local model choice"],
    "strengths": ["Plan/Act workflow, checkpoints, terminal and browser tools", "30+ provider paths plus Ollama and LM Studio", "MCP and automation"],
    "limitations": ["Approval-first loops can be slower", "long loops can be expensive", "capable local models require substantial hardware"],
    "official_sources": [
      {"label": "Overview", "url": "https://docs.cline.bot/cline-overview"},
      {"label": "Authentication", "url": "https://docs.cline.bot/getting-started/authorizing-with-cline"},
      {"label": "Pricing", "url": "https://cline.bot/pricing"},
      {"label": "Repository", "url": "https://github.com/cline/cline"}
    ],
    "last_verified": "2026-08-04"
  },
  {
    "id": "codex",
    "name": "OpenAI Codex",
    "vendor": "OpenAI",
    "status": "active",
    "category": "cli-agent",
    "interfaces": ["desktop", "web", "cli", "ide", "ci", "mobile"],
    "platforms": {
      "operating_systems": ["windows", "macos", "linux"],
      "editors": ["vs-code", "jetbrains"],
      "deployment": [],
      "integrations": [],
      "notes": []
    },
    "execution": "hybrid",
    "model_policy": "vendor-models",
    "byok": true,
    "self_host": false,
    "open_source": true,
    "license": "Apache-2.0 client; proprietary service",
    "pricing": {
      "model": "hybrid",
      "free_tier": true,
      "starting_price_usd_month": 8,
      "note": "Included in ChatGPT Free, Go ($8), Plus ($20), Pro (from $100 with 5x/20x tiers), Business, Edu, and Enterprise; API-key use is token-billed. Plan and regional availability vary."
    },
    "best_for": ["complex end-to-end coding tasks", "local plus cloud delegation", "review and automation"],